<?xml version="1.0" encoding="UTF-8"?>
<studies xmlns:xsi="http://www.w3.org/2001/XMLSchema-instance"
 xsi:noNamespaceSchemaLocation="studyXSD.xsd">
	<study>
		<shortTitle>Ph brain testing funtion</shortTitle>
		<longTitle>A Phase II Evaluation of brain function</longTitle>
		<phaseCode>Phase II Trial</phaseCode>
		<status>Temporarily Closed to Accrual &amp; Treatment</status>
		<terminology><ctcVersion><name>3</name></ctcVersion></terminology>
		<diseaseTerminology><diseaseCodeTerm>CTEP</diseaseCodeTerm></diseaseTerminology>
		<multiInstitutionIndicator>false</multiInstitutionIndicator>
		<identifiers>
			<!-- Funding sponsor study identifier this should be included, reflects the Funding sponsor study identifier on the Details Tab  -->
			<organizationAssignedIdentifier>
				<type>Sponsor Identifier</type>
				<value>kk35</value>
				<primaryIndicator>false</primaryIndicator>
				<organization>
					<name>Cancer Therapy Evaluation Program</name>
				</organization>
			</organizationAssignedIdentifier>
			<!-- Coordinating center study identifier this should be included, reflects the Coordinating center study identifier on the Details Tab  -->
			<organizationAssignedIdentifier>
				<type>Coordinating Center Identifier</type>
				<value>kk35</value>
				<primaryIndicator>false</primaryIndicator>
				<organization>
					<name>Wake Forest Comprehensive Cancer Center</name>
				</organization>
			</organizationAssignedIdentifier>
			<!-- This is optional as you have already specified identifiers -->
			<organizationAssignedIdentifier>
				<type>Site Identifier</type>
				<value>kk35</value>
				<primaryIndicator>false</primaryIndicator>
				<organization>
					<name>Wake Forest Comprehensive Cancer Center</name>
				</organization>
			</organizationAssignedIdentifier>
			<!-- This is optional as you have already specified identifiers -->
			<systemAssignedIdentifier>
				<type>Site Identifier</type>
				<value>kk35</value>
				<primaryIndicator>false</primaryIndicator>
				<systemName>OWQRIS</systemName>
			</systemAssignedIdentifier>
		</identifiers>

		<studyOrganizations>
			<studyFundingSponsor>
				<organization>
					<name>Cancer Therapy Evaluation Program</name>
				</organization>
			</studyFundingSponsor>
			<studySite>
				<organization>
					<name>Wake Forest Comprehensive Cancer Center</name>
				</organization>
			</studySite>
		</studyOrganizations>
	</study>
</studies>
